[
  {
    "name": "suppressed-malformed-links-leave-the-note-out",
    "query_version": "0.1.0",
    "rules": [
      "NL-6",
      "CM-54",
      "CM-619",
      "CM-620"
    ],
    "query": {
      "specification_version": "0.1.0",
      "note_types": [
        "source"
      ],
      "select": [
        {
          "kind": "path",
          "as": "path"
        }
      ]
    },
    "expected_result": {
      "evaluation": "complete",
      "rows": [],
      "skipped": [
        "Notes/Source.md"
      ]
    }
  }
]
